{
  "$schema": "https://json-schema.org/draft/2020-12/schema",
  "$id": "https://srs.semanticops.com/schema/2.0/type.json",
  "title": "SRS Type Definition",
  "description": "A named collection of FieldAssignments that defines the structure of a TypedRecord or Record. Types belong to a namespace and are versioned.",
  "type": "object",
  "required": ["$schema", "id", "namespace", "name", "version", "description", "fields", "createdAt"],
  "additionalProperties": false,
  "properties": {
    "$schema": { "type": "string" },
    "id": {
      "type": "string",
      "format": "uuid"
    },
    "namespace": {
      "type": "string",
      "description": "Logical grouping, e.g. 'governance', 'finance'."
    },
    "name": {
      "type": "string",
      "description": "Machine-readable name within the namespace, snake_case."
    },
    "version": {
      "type": "integer",
      "minimum": 1
    },
    "description": {
      "type": "string"
    },
    "semanticObjectType": {
      "type": "string",
      "description": "Optional canonical semantic classification (e.g. 'decision', 'exercise', 'policy')."
    },
    "aiGuidance": {
      "type": "object",
      "description": "Guidance for AI agents determining whether source material matches this Type.",
      "additionalProperties": false,
      "properties": {
        "purpose": { "type": "string" },
        "extraction": { "type": "string" },
        "negativeGuidance": { "type": "string" }
      }
    },
    "fields": {
      "type": "array",
      "items": { "$ref": "#/$defs/FieldAssignment" },
      "description": "Ordered list of fields that make up this Type."
    },
    "fieldGroups": {
      "type": "array",
      "items": { "$ref": "#/$defs/FieldGroup" },
      "deprecated": true,
      "description": "ext:field-groups — grouped, potentially repeatable field sets. DEPRECATED (RFC-032 Change E): subsumed by a datatype:ref, mode:inline Field over the group's Type. Retained until the #242 cutover provides the inline-composite instance carrier; new authoring MUST use composite range, not FieldGroup."
    },
    "lifecycle": {
      "$ref": "#/$defs/TypeLifecycle",
      "description": "ext:lifecycle — inline state machine declaration. Mutually exclusive with lifecycleRef."
    },
    "lifecycleRef": {
      "type": "string",
      "description": "ext:lifecycle — reference to an installed Lifecycle by id. Mutually exclusive with lifecycle."
    },
    "tags": {
      "type": "array",
      "items": { "type": "string" }
    },
    "extendsTypeId": {
      "type": "string",
      "format": "uuid",
      "description": "ext:type-inheritance — the UUID of the base Type this Type specializes."
    },
    "extendsTypeVersion": {
      "type": "integer",
      "minimum": 1,
      "description": "ext:type-inheritance — the version of the base Type being extended."
    },
    "fieldOrder": {
      "type": "array",
      "items": { "type": "string", "format": "uuid" },
      "description": "ext:type-inheritance — explicit ordering for the merged field list (base + own). Must contain every fieldId from the effective field set exactly once."
    },
    "fieldAssignmentOverrides": {
      "type": "array",
      "items": { "$ref": "#/$defs/FieldAssignmentOverride" },
      "description": "ext:type-inheritance — per-field overrides applied to inherited FieldAssignments."
    },
    "identityFieldId": {
      "type": "string",
      "format": "uuid",
      "description": "RFC-020 — names one fieldId from this Type's effective field set (own fields plus, under ext:type-inheritance, inherited fields) as the record's identity/display field. MUST reference a fieldId present in the effective field set (Rule [N+33]). Under ext:type-inheritance, a Type that declares no identityFieldId of its own inherits the effective identityFieldId of its base Type, resolved transitively up the ancestor chain (Rule [N+34]) — this cascading inheritance is specific to identityFieldId and is not shared with fieldOrder, which is single-level only."
    },
    "validationRules": {
      "type": "array",
      "items": { "$ref": "#/$defs/CrossFieldRule" },
      "description": "ext:cross-field-validation — cross-field validation rules applied to Records of this Type."
    },
    "createdAt": {
      "type": "string",
      "format": "date-time"
    }
  },
  "$defs": {
    "TypeLifecycle": {
      "type": "object",
      "required": ["states", "transitions", "initialState"],
      "additionalProperties": false,
      "properties": {
        "states": {
          "type": "array",
          "minItems": 1,
          "items": { "$ref": "#/$defs/LifecycleState" }
        },
        "transitions": {
          "type": "array",
          "items": { "$ref": "#/$defs/LifecycleTransition" }
        },
        "initialState": {
          "type": "string",
          "description": "Must reference a state name with isInitial: true (Invariant 4)."
        }
      }
    },
    "LifecycleState": {
      "type": "object",
      "required": ["key"],
      "additionalProperties": false,
      "description": "A lifecycle state (VocabularyEntry specialization). key is the unified substrate field (was name pre-RFC-006).",
      "properties": {
        "id": { "type": "string", "format": "uuid" },
        "version": { "type": "integer", "minimum": 1 },
        "namespace": { "type": "string" },
        "key": {
          "type": "string",
          "description": "Machine-readable state key. Unified substrate field (was name)."
        },
        "label": { "type": "string" },
        "description": { "type": "string" },
        "aliases": { "type": "array", "items": { "type": "string" } },
        "isInitial": { "type": "boolean" },
        "isFinal": { "type": "boolean" },
        "status": {
          "type": "string",
          "enum": ["active", "deprecated", "tombstone", "retired"]
        },
        "requiresRelation": { "$ref": "#/$defs/RequiresRelation" },
        "properties": { "type": "object", "additionalProperties": true }
      }
    },
    "RequiresRelation": {
      "type": "object",
      "required": ["relationType"],
      "additionalProperties": false,
      "description": "RFC-022 relational state: a record may only be in this state if a relation satisfying this obligation exists.",
      "properties": {
        "relationType": {
          "type": "array",
          "minItems": 1,
          "items": { "type": "string", "minLength": 1 },
          "description": "Relation type(s) that satisfy the obligation (any-of interpretation, unchanged from RFC-022). RFC-032 Change F normalized this declaration form from string|string[] to a list (length ≥ 1); the single-string form is removed. The distinct scalar fulfillment.relationType selector is untouched."
        },
        "direction": {
          "type": "string",
          "enum": ["incoming", "outgoing"],
          "default": "incoming",
          "description": "incoming: an edge whose target is the record (e.g. successor → predecessor supersedes). outgoing: an edge whose source is the record."
        },
        "enforcement": {
          "type": "string",
          "enum": ["hard", "advisory"],
          "default": "hard",
          "description": "hard (default): a transition into this state MUST be rejected unless the obligation is satisfied or fulfilled (definitional relational states whose meaning is the relationship, e.g. superseded). advisory: the transition is permitted even when unsatisfied, and an unsatisfied obligation is surfaced as a warning at rest, never a rejection (evidentiary obligations that may be established later)."
        }
      }
    },
    "LifecycleTransition": {
      "type": "object",
      "required": ["name", "from", "to"],
      "additionalProperties": false,
      "properties": {
        "id": {
          "type": "string",
          "format": "uuid",
          "description": "Stable UUID identity for this transition edge."
        },
        "name": { "type": "string" },
        "from": { "type": "string" },
        "to": { "type": "string" },
        "description": { "type": "string" },
        "properties": { "type": "object", "additionalProperties": true }
      }
    },
    "FieldAssignment": {
      "type": "object",
      "required": ["fieldId", "order", "required"],
      "additionalProperties": false,
      "properties": {
        "fieldId": {
          "type": "string",
          "format": "uuid",
          "description": "References a Field by its stable id."
        },
        "order": {
          "type": "integer",
          "minimum": 0,
          "description": "Display/processing order within the Type."
        },
        "required": {
          "type": "boolean",
          "description": "Whether this field must be populated before a Record can be logged."
        },
        "repeatable": {
          "type": "boolean",
          "deprecated": true,
          "description": "ext:repeatable-fields — whether this field may contain multiple entries. DEPRECATED (RFC-032 [R4]): cardinality is now the referenced Field's fieldType.cardinality (single/list), overridable per assignment. Retained (with minItems/maxItems) until the #242 cutover, because FieldGroup — whose removal is #242-gated — reuses FieldAssignment."
        },
        "minItems": {
          "type": "integer",
          "minimum": 0,
          "deprecated": true,
          "description": "DEPRECATED (RFC-032 [R4]): moved to fieldType. Retained until the #242 cutover (see `repeatable`)."
        },
        "maxItems": {
          "type": "integer",
          "minimum": 0,
          "deprecated": true,
          "description": "DEPRECATED (RFC-032 [R4]): moved to fieldType. Retained until the #242 cutover (see `repeatable`)."
        },
        "displayLabel": {
          "type": "string",
          "description": "Context-specific label override for this field within this Type."
        },
        "defaultValue": {
          "description": "Optional default value to pre-populate the field."
        }
      }
    },
    "FieldAssignmentOverride": {
      "type": "object",
      "required": ["fieldId"],
      "additionalProperties": false,
      "description": "ext:type-inheritance — overrides for a single inherited FieldAssignment.",
      "properties": {
        "fieldId": {
          "type": "string",
          "format": "uuid",
          "description": "The fieldId of the inherited field being overridden."
        },
        "displayLabel": {
          "type": "string",
          "description": "Rendering-only label override."
        },
        "displayHint": {
          "type": "string",
          "description": "Rendering-only hint text override."
        },
        "required": {
          "type": "boolean",
          "description": "May tighten (false→true) but not relax (true→false) the base field's required status."
        }
      }
    },
    "FieldGroup": {
      "type": "object",
      "required": ["groupId", "order", "fields"],
      "additionalProperties": false,
      "deprecated": true,
      "description": "ext:field-groups. DEPRECATED (RFC-032 Change E): an inline object-of-scalars subsumed by a datatype:ref, mode:inline Field over a first-class Type. Retained (schema + `groupValues` instance carrier) until the #242 cutover provides the inline-composite carrier and #262 restores composite rendering; only then is FieldGroup removed.",
      "properties": {
        "groupId": { "type": "string" },
        "label": { "type": "string" },
        "description": { "type": "string" },
        "order": { "type": "integer", "minimum": 0 },
        "required": { "type": "boolean" },
        "repeatable": { "type": "boolean" },
        "minItems": { "type": "integer", "minimum": 0 },
        "maxItems": { "type": "integer", "minimum": 0 },
        "fields": {
          "type": "array",
          "items": { "$ref": "#/$defs/FieldAssignment" }
        },
        "compositeRenderer": {
          "type": "string",
          "description": "ext:field-groups RFC-007 — dispatch rendering to a named composite renderer. Bare names (e.g. 'table') are SRS-reserved; vendor values use 'reverse-domain/name'. Unknown values fall back to per-field baseline with a diagnostic [FG-Cx1]."
        }
      }
    },
    "CrossFieldRule": {
      "type": "object",
      "required": ["type"],
      "additionalProperties": false,
      "description": "ext:cross-field-validation — a constraint that validates a relationship between fields in a Record.",
      "properties": {
        "type": {
          "type": "string",
          "enum": ["conditional-required", "field-ordering", "mutual-exclusion"],
          "description": "The kind of cross-field constraint."
        },
        "message": {
          "type": "string",
          "description": "Optional human-readable description of the rule."
        },
        "predicateFieldId": {
          "type": "string",
          "format": "uuid",
          "description": "Field whose value is tested (conditional-required, field-ordering)."
        },
        "predicateValue": {
          "type": "string",
          "description": "Value the predicate field must equal to activate the rule (conditional-required)."
        },
        "targetFieldId": {
          "type": "string",
          "format": "uuid",
          "description": "Field that is constrained when the rule fires (conditional-required, field-ordering)."
        },
        "effect": {
          "$ref": "#/$defs/CrossFieldRuleEffect",
          "description": "Ordering direction for a field-ordering rule."
        },
        "fieldIds": {
          "type": "array",
          "items": { "type": "string", "format": "uuid" },
          "minItems": 2,
          "description": "Fields of which at most one may be non-empty (mutual-exclusion)."
        }
      }
    },
    "CrossFieldRuleEffect": {
      "type": "string",
      "enum": ["must-precede", "must-follow"],
      "description": "Ordering direction for a field-ordering rule: the predicate field must-precede or must-follow the target."
    }
  }
}
